{"catalysts":[],"dailyBrief":null,"generatedAt":"2026-08-21T08:07:15.996569+00:00","health":{"backend":"sqlite","catalystCount":0,"fresh":true,"lastSuccessfulUpdate":null,"rawItemCount":440,"signalCount":25,"status":"degraded"},"regime":{"environment":[{"evidenceType":"official","id":"growth","label":"增长","observedAt":"2026-08-21","state":"跟踪最新宏观信号","tone":"neutral"},{"evidenceType":"official","id":"inflation","label":"通胀","observedAt":"2026-08-21","state":"待最新价格数据验证","tone":"neutral"},{"evidenceType":"official","id":"liquidity","label":"流动性","observedAt":"2026-08-21","state":"跟踪最新流动性信号","tone":"positive"},{"evidenceType":"proxy","id":"risk","label":"风险偏好","observedAt":"2026-08-21","state":"结构分化","tone":"neutral"},{"evidenceType":"proxy","id":"valuation","label":"估值","observedAt":"2026-08-21","state":"待最新估值数据验证","tone":"neutral"}],"label":"结构分化","rationale":["市场环境由最新已发布信号生成，专项指标不足时明确标记待验证"],"status":"neutral"},"schemaVersion":1,"signals":[{"category":"unclassified","clusterId":"cluster-0148a0e40ec91535","customerDemandScore":0.0,"demandKind":"unknown","id":"signal-f4897fd938dce8e0","priority":67,"publishedAt":"2026-08-21T08:07:15.996569+00:00","sourceConfidence":1.0,"sources":[{"confidence":1.0,"excerpt":"2026年7月份规模以上工业增加值增长4.5%","url":"https://www.stats.gov.cn/sj/zxfb/202608/t20260817_1965055.html"}],"summary":"2026年7月份规模以上工业增加值增长4.5%","title":"2026年7月份规模以上工业增加值增长4.5%","updatedAt":"2026-08-21T08:07:15.996569+00:00","validationStatus":"confirmed"},{"category":"unclassified","clusterId":"cluster-0e915a7b18938bde","customerDemandScore":0.0,"demandKind":"unknown","id":"signal-dba609a1948747f4","priority":67,"publishedAt":"2026-08-21T08:07:15.996569+00:00","sourceConfidence":1.0,"sources":[{"confidence":1.0,"excerpt":"农业农村部","url":"http://www.moa.gov.cn/"}],"summary":"农业农村部","title":"农业农村部","updatedAt":"2026-08-21T08:07:15.996569+00:00","validationStatus":"confirmed"},{"category":"unclassified","clusterId":"cluster-01efc5021f153b88","customerDemandScore":0.0,"demandKind":"unknown","id":"signal-cb0c63725bdbb11c","priority":67,"publishedAt":"2026-08-21T08:07:15.996569+00:00","sourceConfidence":1.0,"sources":[{"confidence":1.0,"excerpt":"1—7月份国民经济保持总体平稳、向新向优发展态势","url":"https://www.stats.gov.cn/sj/zxfb/202608/t20260817_1965056.html"}],"summary":"1—7月份国民经济保持总体平稳、向新向优发展态势","title":"1—7月份国民经济保持总体平稳、向新向优发展态势","updatedAt":"2026-08-21T08:07:15.996569+00:00","validationStatus":"confirmed"},{"category":"unclassified","clusterId":"cluster-0b8609ecbd5e5a78","customerDemandScore":0.0,"demandKind":"unknown","id":"signal-c9d8f9ae1f402784","priority":67,"publishedAt":"2026-08-21T08:07:15.996569+00:00","sourceConfidence":1.0,"sources":[{"confidence":1.0,"excerpt":"机构","url":"https://www.stats.gov.cn/jg/"}],"summary":"机构","title":"机构","updatedAt":"2026-08-21T08:07:15.996569+00:00","validationStatus":"confirmed"},{"category":"unclassified","clusterId":"cluster-00030cc250da8766","customerDemandScore":0.0,"demandKind":"unknown","id":"signal-b551bfbea2e2cf7c","priority":67,"publishedAt":"2026-08-21T08:07:15.996569+00:00","sourceConfidence":1.0,"sources":[{"confidence":1.0,"excerpt":"浙江局","url":"http://tjj.zj.gov.cn/"}],"summary":"浙江局","title":"浙江局","updatedAt":"2026-08-21T08:07:15.996569+00:00","validationStatus":"confirmed"},{"category":"unclassified","clusterId":"cluster-077acf2c4b138ae5","customerDemandScore":0.0,"demandKind":"unknown","id":"signal-b2c15f6c110d9dc7","priority":67,"publishedAt":"2026-08-21T08:07:15.996569+00:00","sourceConfidence":1.0,"sources":[{"confidence":1.0,"excerpt":"2026年7月下旬流通领域重要生产资料市场...","url":"https://www.stats.gov.cn/sj/zxfb/202608/t20260803_1964273.html"}],"summary":"2026年7月下旬流通领域重要生产资料市场...","title":"2026年7月下旬流通领域重要生产资料市场...","updatedAt":"2026-08-21T08:07:15.996569+00:00","validationStatus":"confirmed"},{"category":"unclassified","clusterId":"cluster-01a8d124e51e86ad","customerDemandScore":0.0,"demandKind":"unknown","id":"signal-a1fbb815a06a972a","priority":67,"publishedAt":"2026-08-21T08:07:15.996569+00:00","sourceConfidence":1.0,"sources":[{"confidence":1.0,"excerpt":"自然资源部","url":"http://www.mnr.gov.cn/"}],"summary":"自然资源部","title":"自然资源部","updatedAt":"2026-08-21T08:07:15.996569+00:00","validationStatus":"confirmed"},{"category":"unclassified","clusterId":"cluster-0c299d59654acf94","customerDemandScore":0.0,"demandKind":"unknown","id":"signal-83a0cf710ee7962e","priority":67,"publishedAt":"2026-08-21T08:07:15.996569+00:00","sourceConfidence":1.0,"sources":[{"confidence":1.0,"excerpt":"2026年1—7月份社会消费品零售总额增长1.2%","url":"https://www.stats.gov.cn/sj/zxfb/202608/t20260817_1965052.html"}],"summary":"2026年1—7月份社会消费品零售总额增长1.2%","title":"2026年1—7月份社会消费品零售总额增长1.2%","updatedAt":"2026-08-21T08:07:15.996569+00:00","validationStatus":"confirmed"},{"category":"unclassified","clusterId":"cluster-079d2b445627ccd1","customerDemandScore":0.0,"demandKind":"unknown","id":"signal-7ebcf503a8934431","priority":67,"publishedAt":"2026-08-21T08:07:15.996569+00:00","sourceConfidence":1.0,"sources":[{"confidence":1.0,"excerpt":"国务院台办","url":"http://www.gwytb.gov.cn/"}],"summary":"国务院台办","title":"国务院台办","updatedAt":"2026-08-21T08:07:15.996569+00:00","validationStatus":"confirmed"},{"category":"unclassified","clusterId":"cluster-029379dfa65adb89","customerDemandScore":0.0,"demandKind":"unknown","id":"signal-6ba41d254cfad998","priority":67,"publishedAt":"2026-08-21T08:07:15.996569+00:00","sourceConfidence":1.0,"sources":[{"confidence":1.0,"excerpt":"国家能源局","url":"http://www.nea.gov.cn/"}],"summary":"国家能源局","title":"国家能源局","updatedAt":"2026-08-21T08:07:15.996569+00:00","validationStatus":"confirmed"}],"themes":[]}
